<?xml version="1.0"?>
<!--
To change this license header, choose License Headers in Project Properties.
To change this template file, choose Tools | Templates
and open the template in the editor.
-->

<xs:schema version="1.0"
           xmlns:xs="http://www.w3.org/2001/XMLSchema"
           elementFormDefault="qualified">
    <!--Declaracion de tipos-->
    
    <!--Declaracion de elementos-->
    <xs:element name="receta">
        <xs:complexType>
            <xs:sequence>
                <xs:element name="nombre" type="xs:string"/>
                <xs:element name="descripcion" type="xs:string" minOccurs="0"/>
                <xs:element name="tiempo">
                    <xs:complexType>
                        <xs:attribute name="preparacion" use="required">
                            <xs:simpleType>
                                <xs:restriction base="xs:integer">
                                    <xs:minInclusive value="1"/>
                                    <xs:maxInclusive value="999"/>
                                </xs:restriction>
                            </xs:simpleType>
                        </xs:attribute>
                        <xs:attribute name="coccion" use="optional">
                            <xs:simpleType>
                                <xs:restriction base="xs:integer">
                                    <xs:minInclusive value="1"/>
                                    <xs:maxInclusive value="999"/>
                                </xs:restriction>
                            </xs:simpleType>
                        </xs:attribute>
                    </xs:complexType>
                </xs:element>
                <xs:element name="ingredientes">
                    <xs:complexType>
                        <xs:sequence>
                            <xs:element name="ingrediente">
                                <xs:complexType>
                                    <xs:sequence>
                                        <xs:element name="nombre" type="xs:string"/>
                                        <xs:element name="cantidad" type="xs:positiveInteger" minOccurs="0">  
                                            <xs:complexType>
                                                <xs:simpleContent>
                                                    <xs:extension base="xs:string">
                                                        <xs:attribute name="unidad" use="optional">
                                                            <xs:simpleType>
                                                                <xs:restriction base="xs:string">
                                                                    <xs:pattern value="gramos|pizca|mililitros|cucharada|chorro"/>
                                                                </xs:restriction>
                                                            </xs:simpleType>
                                                        </xs:attribute>
                                                    </xs:extension>
                                                </xs:simpleContent>
                                            </xs:complexType>
                                        </xs:element>
                                    </xs:sequence>
                                </xs:complexType>
                            </xs:element>
                        </xs:sequence>
                    </xs:complexType>
                </xs:element>
                <xs:element name="instrucciones" minOccurs="0">
                    <xs:complexType>
                        <xs:sequence>
                            <xs:element name="paso" type="xs:string" maxOccurs="10"></xs:element>
                        </xs:sequence>
                    </xs:complexType>
                </xs:element>
            </xs:sequence>
            <xs:attribute name="plato" use="required">
                <xs:simpleType>
                    <xs:restriction base="xs:string">
                        <xs:enumeration value="primero"/>
                        <xs:enumeration value="segundo"/>
                        <xs:enumeration value="postre"/>
                    </xs:restriction>
                </xs:simpleType>
            </xs:attribute>
        </xs:complexType>
    </xs:element>
</xs:schema>
