<?xml version="1.0" encoding="UTF-8"?>
<!DOCTYPE receta SYSTEM "receta.dtd">
<!--
To change this license header, choose License Headers in Project Properties.
To change this template file, choose Tools | Templates
and open the template in the editor.
-->
<receta plato="primero"
        xmlns:xsi='http://www.w3.org/2001/XMLSchema-instance'
        xsi:noNamespaceSchemaLocation='receta.xsd'>
    <nombre>Risotto milanesa</nombre>
    <tiempo preparacion="30" coccion="20"></tiempo>
    <ingredientes>
        <ingrediente>
            <nombre>Arroz</nombre>
            <cantidad unidad="gramos">500</cantidad>
        </ingrediente>
        <ingrediente>
            <nombre>Cebolla mediana</nombre>
            <cantidad>1</cantidad>
        </ingrediente>
        <ingrediente>
            <nombre>Azafran</nombre>
            <cantidad unidad="pizca">1</cantidad>
        </ingrediente>
        <ingrediente>
            <nombre>Queso parmesano</nombre>
            <cantidad unidad="gramos">100</cantidad>
        </ingrediente>
        <ingrediente>
            <nombre>Mantequilla</nombre>
            <cantidad unidad="gramos">100</cantidad>
        </ingrediente>
        <ingrediente>
            <nombre>Sal</nombre>
        </ingrediente>
        <ingrediente>
            <nombre>Pimienta</nombre>
        </ingrediente>
        <ingrediente>
            <nombre>Caldo</nombre>
            <cantidad unidad="mililitros">1000</cantidad>
        </ingrediente>
        <ingrediente>
            <nombre>Vino blanco</nombre>
            <cantidad unidad="chorro">1</cantidad>
        </ingrediente>
    </ingredientes>
    <instrucciones>
        <paso>1.-Picamos la cebolla y la pochamos con la mitad
            de la mantequilla.</paso>
        <paso>2.-Cuando esté transparente, echamos el azafrán,
            el vino y dejamos que reduzca.</paso>
        <paso>3.-A continuación, incorporamos el arroz, lo
            sofreímos un poco.</paso>
        <paso>4.-Vamos añadiendo el caldo caliente poco a poco
            mientras removemos</paso>
        <paso>5.-Salpimentamos</paso>
        <paso>6.-Cuando esté casi hecho, agregamos el resto de
            la mantequilla y el queso</paso>
        <paso>7.-Servimos enseguida</paso>
    </instrucciones>
</receta>
